ID_file,leg,class,language,surname,name,year_birth,gender,group,posizione_del_chunk,chunk
47990,XVI,"ENTI LOCALI, Comuni",it,Ganis,Christian,1973,M,N/A,20,"Ringrazio gli intervenuti e i proponenti di
questa proposta di legge, la 138 della Lega.
La proposta di legge 138 rappresenta un tentativo di affrontare
una delle sfide più pressanti delle comunità montane, che è quella
dello spopolamento.
La Valle d'Aosta, come molte altre regioni montane, sta vivendo
un progressivo esodo della popolazione dei centri più piccoli verso
le città; questo fenomeno ha ripercussioni significative
sull'economia locale, sulla cultura e sulla valorizzazione dei
nostri territori.
La proposta mira a invertire questa tendenza attraverso una
serie di misure concrete, focalizzate principalmente su incentivi
economici, quindi l'assegno di natalità o Chèque Valdôtain, un
contributo economico alle famiglie che scelgono di avere figli nei
piccoli Comuni montani, incentivi per i nuovi residenti, lo Chèque
Montagnard, agevolazioni fiscali e contributi per chi chiede o
decide di stabilirsi in questi territori e la valorizzazione del
territorio attraverso la promozione della cultura locale, quindi
sostegno alle tradizioni e alle lingue minoritarie, lo sviluppo del
turismo sostenibile, investimenti e attività turistiche rispettose
dell'ambiente e la garanzia dei servizi di base come la sanità, la
scuola e i trasporti, ne abbiamo parlato prima.
Da una prima analisi, la proposta della Lega presenta diversi
punti di forza, un approccio concreto, quindi le misure proposte
sono specifiche e mirate per risolvere i problemi, un'attenzione
alle famiglie, quindi: incentivi alla natalità, alle famiglie con
figli e una valorizzazione del territorio.
A nostro avviso, seppure la proposta rappresenti un passo avanti
nella direzione di una politica regionale più attenta alle esigenze
dei Comuni montani, alcune problematiche emergono; una di queste è
la sostenibilità economica: mettere in pratica queste misure
richiede risorse economiche significative e l'efficacia a lungo
termine. Gli incentivi economici possono essere un primo passo, ma
è necessario un approccio più strutturale per garantire la
sostenibilità a lungo termine dei Comuni montani; la collaborazione
con gli Enti locali: il successo di queste misure dipende anche
dalla collaborazione con i Comuni, l'ha ricordato bene il collega
Chatrian.
Per giungere quindi a una conclusione, la proposta di legge 138
della Lega rappresenta un importante contributo al dibattito sulla
valorizzazione delle aree montane, sollevando un tema di grande
importanza e futuro per la nostra regione, tuttavia è importante
sottolineare che il problema legato al fenomeno dello spopolamento
non può essere risolto soltanto con degli incentivi economici,
abbiamo detto più volte e ribadito che sono necessarie una serie di
azioni politiche di sviluppo territoriale a lungo termine, che
tengono conto di tutti gli attori coinvolti al fine di raggiungere
risultati concreti e duraturi.
Partendo dal presupposto che questa proposta di legge poteva
anche essere emendata al fine di migliorarla e di renderla più
adatta alle esigenze della nostra comunità, noi come gruppo ne
apprezziamo il lavoro e per questo motivo la voteremo."
47990,XVI,"ENTI LOCALI, Comuni",it,Aggravi,Stefano,1985,M,N/A,21,"Ci sono altre dichiarazioni di voto?
Consigliere Lavy, ne ha facoltà."
47990,XVI,"ENTI LOCALI, Comuni",it,Lavy,Erik,1995,M,N/A,22,"Grazie, Presidente, per le ultime
considerazioni che sono emerse dopo la replica del Governo.
Non so se l'assessore Caveri abbia letto davvero ""Tradition et
renouveau"" di Janin perché altrimenti, non so, certi ragionamenti
forse non li avrebbe fatti...
(
Interruzione fuori microfono da parte dell'assessore
Caveri.)
...Non è assolutamente offensivo, ci mancherebbe altro.
Il discorso dell'altimetria, per carità, è discutibile, ma io
magari la inviterei un giorno, anzi, di vivere un po' di tempo, di
andare a Marine di Perloz: vorrei vedere se quella non è montagna.
Non è alta montagna, per carità, ma è montagna.
Poi va bene la questione del cambiamento climatico, è ovvio che
siamo di fronte a delle sfide epocali, come ci sono sempre state
nel corso della storia, per carità, oggi ne abbiamo di nuove e
quindi giustamente dobbiamo adattarci.
Il tema dei sovraccosti, che ha tirato fuori lei - se prima si è
offeso, adesso le do atto di aver tirato fuori un tema che è
essenziale - il tema dei sovraccosti è centrale, l'ho detto: vivere
in montagna costa di più, ed è per questo che credo che ci sia
bisogno di un aiuto economico, da un lato con i contributi,
dall'altro con una defiscalizzazione, cose che sono proposte da
questa legge, quindi, per carità, non comprendete al 100% il modo?
Va bene, ma, come ho detto prima, dov'è la vostra proposta?
Il discorso della demografia, che è stato toccato anche prima
dal collega Chatrian: ""Eh, ma questa legge parla di un assegno di
natalità"", più demografia di così... quindi si può dire di tutto,
ma non che questa legge non tocchi il discorso della
demografia.
Poi il presidente Testolin come al solito un po' sorvola... però
la cosa su cui rifletto - e sugli appunti avevo la risposta che lei
aveva dato al collega Restano, quando avevo citato la legge 17 e
varie leggi - è che non mi sembra che in queste leggi ci sia una
parte ad hoc per il territorio montano. Ci sono delle leggi che
valgono per tutti i territori, quindi, se prendiamo la 17, ne
usufruiscono coloro che hanno un'azienda agricola del Fondovalle
chi ha un'azienda agricola a 1.500 metri.
È ovvio che è una legge che aiuta anche chi vive in montagna,
non è una legge che è solo fatta per chi vive in montagna e che va
a compensare dei sovraccosti di chi vive in montagna; è questo il
discorso.
Le nostre leggi non sono diversificate, sono uguali per tutti,
da un lato va bene, dall'altro lato bisogna, credo, fare anche
delle riflessioni, ma allora non è che con quelle leggi si aiuta
solo chi vive in montagna.
Io veramente, per concludere, perché ho capito che tanto non ce
n'è, vorrei veramente che andaste a fare un giro in tanti villaggi
dei nostri comuni, in giro per la Valle, tutti i comuni hanno dei
villaggi che ormai sono abbandonati, o quasi, e lì capirete le
radici dello spopolamento, veramente.
Andate nelle valli a parlare con chi rimane e che vi spiegherà
che il proprio figlio ha deciso di andarsene, magari neanche
all'estero, è sceso.
Capirete da queste persone il motivo per cui le persone se ne
vanno: i sovraccosti - l'ha detto lei, assessore Caveri - e quei
villaggi lì, se va bene, diventeranno seconde case, se va male,
saranno diroccati.
È questa politica del dire ""Stiamo già facendo"" che ammazza quei
villaggi, che ammazza la programmazione. Mettiamoci per una volta
in discussione, non è possibile dire ""Stiamo già facendo, va tutto
bene"", guardate le valli del Piemonte, le vediamo tutti le valli
del Piemonte, ma se continuiamo così, ci arriviamo anche noi alle
valli del Piemonte.
Mettiamoci in discussione, portiamo avanti delle misure che
possono anche essere sperimentali, il discorso zona franca è
assolutamente positivo ma non basta, non basta!
Sapete quando non si parlerà più di spopolamento? Quando
l'ultimo anziano dell'ultimo villaggio sarà mancato, allora lì non
ci sarà più il problema dello spopolamento, perché tanto non ci
sarà più nessuno che abita in Valle d'Aosta.
Il fatto che non ci sia stata la volontà di ragionare in maniera
concreta su di un testo di legge e che questa legge abbia dei
principi favorevoli, interessanti, ma che non bastano, è una
pugnalata veramente a chi abita in montagna."
47990,XVI,"ENTI LOCALI, Comuni",it,Aggravi,Stefano,1985,M,N/A,23,"Ci sono altre dichiarazioni di voto?
Consigliere Perron."
47990,XVI,"ENTI LOCALI, Comuni",it,Perron,Simone,1979,M,N/A,24,"Ovviamente voterò positivamente per
questa legge. Se prima ho evidenziato il lato dello spirito
autonomistico che contraddistingue questa proposta di legge,
dall'altro voglio semplicemente rimarcare, come dicevo prima, al di
là del fattore economico, un elemento che caratterizza fortemente
invece la nostra forza politica, cioè la Lega, perché questo è, da
un altro punto di vista, il tentativo di attirare sul nostro
territorio, in particolare su quello di montagna, un'immigrazione
che può essere scelta, un'immigrazione che possa essere di tipo
sostenibile, alle antitesi di coloro che invece pretendono o
pensano che chiunque possa arrivare sul nostro territorio, anche
quando ha atteggiamenti o culture o mentalità che difficilmente si
integrano con la nostra millenaria cultura.
Ripeto, una legge perfettamente nel solco del nostro partito che
vede e pensa che coloro che possono venire sul nostro territorio e
sentirsi e diventare Valdostani a pieno titolo debbano essere
persone che hanno gli strumenti per integrarsi; in questo caso
sarebbe proprio l'ente regionale a fornire degli strumenti dal
punto di vista linguistico, che è fondamentale.
Da questo punto di vista, quindi, io credo che sia una proposta
di legge che è un vero peccato che rimanga lì, ma io penso che
resterà, comunque sia, negli archivi e un giorno, quando magari gli
storici guarderanno indietro e ascolteranno dei dibattiti di questo
Consiglio, potranno vedere chi aveva quantomeno il coraggio di
proporre qualcosa, anche a titolo sperimentale, perché l'ha detto
molto bene il collega: anche a titolo sperimentale, piuttosto che
adagiarsi e adeguarsi a dinamiche che non possiamo controllare
senza fare lo sforzo, magari anche sbagliato, magari che non
funziona, ma uno sforzo che rappresenta una novità verso fenomeni
di grande rilievo e che purtroppo non riusciamo a governare.
Io credo che questo sia un vero peccato, ma, ripeto, chi
proponeva qualcosa di nuovo e aveva il coraggio di farlo rimarrà
negli annali, mentre, invece, dall'altra parte, chi faceva magari
delle critiche, aveva dei buoni propositi, poi sul tavolo, però,
non ha mai messo qualcosa d'innovativo."
47990,XVI,"ENTI LOCALI, Comuni",it,Aggravi,Stefano,1985,M,N/A,25,"Consigliere Cretier, ne ha facoltà."
47990,XVI,"ENTI LOCALI, Comuni",it,Cretier,Paolo,1963,M,N/A,26,"Sarò molto breve vista l'ora e vista la
discussione che c'è stata su questa legge presentata dal collega
Lavy , a cui bisogna dare atto dell'impegno lodevole che ha messo a
proporre questa legge, che però non può essere sostenuta: secondo
noi ci sono troppe difficoltà, come già espresse, sotto l'aspetto
finanziario, fiscale, eccetera, ma soprattutto imporre un corso
entro i primi due anni mi sembra di forzare e di opprimere
veramente una libera scelta di vivere in una comunità, creando dei
cittadini di serie A e dei cittadini di serie B, e pensando anche
che alcuni immigrati, per esempio, potrebbero essere avvantaggiati:
tutti quelli che arrivano dai paesi francofoni, probabilmente e
giustamente, avrebbero un beneficio, quindi credo che questo sia un
elemento da valutare.
Comunque è difficile rispondere alla domanda che pongo: ""Se gli
aiuti economici possano incidere nelle scelte di vita della
famiglia e in particolare dei nostri figli"".
Io credo che sono altri i valori, ad esempio l'amore della
montagna, della cultura, delle tradizioni, che non sono
monetizzabili, anche a costo di sacrifici, poi domani sicuramente
tutto cambia.
Riguardo alla questione dei cittadini, puntualizzo: davanti alla
Costituzione siamo tutti uguali."
47990,XVI,"ENTI LOCALI, Comuni",it,Aggravi,Stefano,1985,M,N/A,27,"Ci sono altri interventi? Non vedo altre
dichiarazioni di voto, pertanto passiamo alla votazione
dell'articolato. Articolo numero 1, non ci sono interventi,
mettiamolo in votazione. La votazione è aperta. La votazione è
chiusa.
Presenti: 35
Votanti: 9
Favorevoli: 9
Astenuti: 26 (Aggravi, Barmasse, Bertin, Bertschy, Brunod,
Carrel, Caveri, Chatrian, Cretier, Di Marco, Grosjacques,
Guichardaz Erika, Guichardaz Jean-Pierre, Jordan, Lavevaz,
Lucianaz, Malacrinò, Marguerettaz, Marzi, Minelli, Padovani,
Planaz, Restano, Rosaire, Sapinet, e Testolin).
L'articolo n. 1 è stato respinto. In base all'articolo 77 del
regolamento del Consiglio, l'intera proposta di legge si intende
respinta."
