ID_file,leg,class,language,surname,name,year_birth,gender,group,posizione_del_chunk,chunk
47990,XVI,"ENTI LOCALI, Comuni",it,Lavy,Erik,1995,M,N/A,14,"Ringrazio i colleghi per il dibattito.
Andrò con ordine, per cercare di rispondere anche alle varie
questioni che sono state messe sul piatto, perché sapevo benissimo
che alla fine i toni delle risposte sarebbe stati questi, una sorta
di benaltrismo, la necessità di fare un provvedimento globale, la
necessità di fare delle riflessioni e va bene, andiamo avanti anni,
anni e anni a fare le riflessioni, però il fenomeno lo vediamo, ma,
appunto, vado con ordine, cominciando dalle parole del collega
Restano, che ha chiesto se, in qualche maniera, non si potesse
mettere in relazione questo testo con quello sulle zone franche
montane, che noi abbiamo assolutamente appoggiato, perché è
qualcosa d'interessante, che ha però un limite: la temporaneità,
per cui se si applica una zona franca montana in un certo
territorio, dura tot anni e poi la condizione rimane, ritorna come
quella precedente, perché i deficit strutturali del territorio
rimangono. Se uno è a mezz'ora di strada da Aosta, non è che con la
zona franca montana venga ridotto quel tempo lì, rimane sempre
mezz'ora di strada, è così; sicuramente è molto interessante, ma la
zona franca ha un carattere di temporaneità, quindi dopo tot anni
quelle misure terminano.
Se si fosse voluto avere collaborazione, era possibile farlo,
perché il testo sulle zone franche montane è stato promosso mi
sembra a luglio, se non ricordo male, e questa legge è depositata
dal mese di aprile, quindi ci fosse stata la volontà di parlarsi,
questa c'era.
Ho notato, è l'ho già detto in discussione di quella legge, che
però avete preso spunto da questa legge, dall'articolo 6, quello
sull'esenzione dell'addizionale regionale IRPEF: voi l'avete messa
un poco più in generale, però questa non mi sembra tanto
collaborazione ma, più che altro, altro, e qui per la proposta di
legge statale - sicuramente è una proposta interessante - almeno un
articolo è stato un po' copiato.
Sui criteri, è ovvio e l'ho detto io in primis: i criteri sono
assolutamente discutibili, cioè oggi chi è che può definire cos'è
montagna e cosa non è montagna? Abbiamo fatto un tentativo, ma il
vostro dov'è? Perché è facile dire: ""Eh, questi criteri, 800
abitanti, 650 metri, non vanno bene, bisogna trovarne altri"", e
quali sono questi altri? Quali sono? È facile dirlo, no? Provate a
metterne giù alcuni e poi ragioniamoci.
Io il primo giorno che sono arrivato in Commissione ho detto:
""Se avete delle proposte, fatele""; proposte zero, nemmeno una,
quindi non si venga a dire che i criteri sono sbagliati, non sono
del tutto convincenti, sono il primo a dirlo, ma se avevate una
proposta migliore dovevate farla. Io di proposte non ne ho
viste.
Il collega Jordan ha detto che questa sarebbe una legge che ha
interventi a spot e limitati: non so se il testo sia chiaro, mi
sembra di sì, queste misure sono strutturali, quindi, se venisse
approvata questa legge, le misure durerebbero nel tempo fino a che
uno vuole, tutti i due i contributi e anche l'esenzione addizionale
IRPEF. Ho inserito il triennio perché sono stato obbligato a
inserirlo, perché bisogna basare sul periodo di imposta sul
triennio, ma anche quella misura sarebbe stata strutturale.
Poi sono d'accordo che non basta l'esenzione addizionale
regionale IRPEF, sono d'accordo, ma intanto cominciamo a fare
questo se è possibile e se c'è la volontà, visto che si parla tanto
di montagna.
Per la questione della scelta di vita, i 10 anni, il fatto del
corso francoprovenzale Titsch e Töitschu: un provvedimento del
genere, portare delle persone a vivere in un contesto come quello
montano, che non è assolutamente semplice, anzi, è una scelta di
vita seria, molto seria... per cui uno lo sa che, se decide di
venire a vivere in quel territorio lì e accede ai contributi, deve
rimanere lì per dieci anni. Se uno ha dei dubbi di non rimanerci,
non ci viene, punto, non ci viene, non fa quella scelta lì, va da
un'altra parte, va in città e non fa quella scelta o sa dove sta,
se è contento.
Stessa cosa per il corso di lingua, uno sa che deve farlo, se
non gli va di farlo, basta, non viene, non è un problema. Questo
serve per integrare coloro che vengono, ma anche per dare una bella
svegliata a noi, perché siamo noi i primi a non parlare il nostro
patois ai nostri figli, è una cosa drammatica, e poi è ovvio che
tutto si perde.
Se al Valdostano invece viene detto: ""Guarda, c'è quello lì che
arrivato ieri, che sta facendo il corso di patois, tu lo parli?"",
""No"", forse può nascere un minimo di moto d'orgoglio e dire: ""No,
le nostre lingue dobbiamo essere anche noi a parlarle, non è che
deve parlarle quello che è arrivato ieri.
Discorso dei servizi: il discorso dei servizi è assolutamente
centrale, ma le due cose devono andare di pari passo. Negli anni 80
(mettiamo così) avevamo più o meno servizi rispetto a oggi nei
territori montani? Probabilmente di più. Abbiamo sportelli bancari
- farò un'interpellanza per quanto riguarda la desertificazione
bancaria e quant'altro - ma quante scuole avevamo in più?
Tante.
Se 40 anni fa avevamo più servizi e oggi ce ne sono di meno,
significa che i servizi non sono la condizione per cui la gente
rimane a tutti i costi in montagna - è una condizione
importantissima ma non è l'unica - quindi si deve agire su di un
aspetto che qua spesso non viene considerato: vivere in montagna
costa di più, pensiamo già solamente al costo del riscaldamento,
quindi se non andiamo incontro a chi vive in certi territori e ha
dei costi maggiori, è ovvio che qualcuno può decidere di
andarsene.
Poi, sempre il collega Chatrian, lei ha detto: ""Se affrontiamo
oggi questo tema, è perché noi abbiamo tenuto (ha usato questo
brutto termine, l'ha detto lei) rispetto ad altre regioni"", e sono
d'accordissimo, se andiamo a vedere in Piemonte, certe valli sono
drammaticamente vuote, non c'è più nessuno o quasi.
Noi forse siamo 20-30 anni indietro rispetto a quelle valli, se,
in qualche maniera, a oggi non facciamo delle misure che possano
invertire la situazione, è quello l'obiettivo a cui si arriva,
perché - l'ha detto sempre lei, collega Chatrian - la demografia è
una scienza esatta. Oggi abbiamo tot nati, in prospettiva potremmo
avere tot abitanti, senza considerare quelli che poi se ne vanno, e
lì è un altro discorso.
Sicuramente il tema dei servizi è da portare avanti e
sicuramente questo è un testo che non può essere complessivo, ma se
vogliamo aspettare un testo complessivo, campa cavallo, ci mettiamo
due secoli per mettere dentro tutto.
Iniziamo da un testo... poi la cosa anche interessante, e l'ha
detto anche in Commissione il presidente Testolin, quando è venuto,
ha detto: ""Avete dei dubbi? Su alcune questioni, sono io in primis
ad avere dei dubbi""; e ci sta, ma proviamo in maniera sperimentale
a portare avanti una legge del genere.
Scegliamo due-tre Comuni, che magari possono avere anche delle
caratteristiche diverse, e proviamo in qualche maniera a
sperimentare queste misure. Dopo cinque anni vediamo i risultati,
se non ci sono risultati, io sono il primo a dire: ""No, questa è
una strada sbagliata"", ma se non ci proviamo neanche, non veniamo a
dire che questo è qualcosa che magari non serve. Proviamoci in
maniera sperimentale, poi vediamo, ma tanto qui non c'è mai il
coraggio di fare niente, quindi ci si siede su quello che stiamo
già facendo e intanto tutto viene giù.
Perché qui, a parlare di montagna, a parlare di terre alte, a
parlare di villaggi, non sono in tanti, o meglio, ce ne sono alcuni
che sono per la maggior parte quelli che ancora vivono in questi
territori e, se ci contiamo, coloro che vengono da Comuni più
montani, non siamo più tanti, anzi, siamo molto, ma molto
pochi.
Qui, anche in ottica di rappresentanza futura, è ovvio che in
prospettiva chi viene dalla città, chi viene dalla Plaine, ha
sempre più un peso anche elettorale e di rappresentanza, quindi
quelli che vengono dalle montagne in aula saranno sempre meno,
perché, io lo vedo, della mia generazione, di persone che abitano
lì e che poi si occupano di politica ce ne sono pochissime, quindi
in prospettiva rischiamo di consegnare la Valle d'Aosta - che
qualcuno dice territorio interamente montano - a gente che di
montagna non sa nulla.
Questo è un aspetto importante, quindi, o facciamo qualcosa
adesso, anche con delle misure forti, sperimentali, altrimenti
alziamo bandiera bianca, consideriamo montagna Piazza Chanoux,
perché qualcuno arriverà a dire questo, ormai in certi parametri
Aosta è considerata in toto montagna. Per carità, alcune frazioni
sì, lo sono, ma Aosta non è montagna, mi dispiace.
Mi riserverò ancora in dichiarazione di voto magari alcune
considerazioni, perché abbiamo tanti paradossi.
Abbiamo per esempio un deputato dell'Union Valdôtaine che
propone in Parlamento una mozione per le aree interne e le aree
montane.
Va bene, siamo capaci tutti a proporre delle mozioni, poi però
vorrei capire cosa ne pensi lui di questa proposta di legge, capire
se possa essere interessante o meno.
Il dato di fatto che ho notato, perché ovviamente non è che una
volta che ho presentato la proposta di legge sono stato lì a
dormire, ho girato e sono andato in 23 Comuni, da 23 Sindaci, che
appunto erano protagonisti di questa proposta di legge.
Alcuni di questi, che poi hanno stupito me stesso, erano stupiti
del fatto che ci fosse per la prima volta, nell'arco del loro
governo del Comune, un Consigliere regionale che andasse a trovarli
- cosa che mi ha sinceramente lasciato stupito - e tutti questi
Sindaci hanno comunque espresso grande attenzione verso questa
legge, ma veramente grande attenzione, chi più chi meno, per
carità, sapendo benissimo che non era risolutiva, poi però sappiamo
che la politica agisce in certi sistemi e il CPEL soprattutto
agisce, lo vediamo: tanti sindaci sono i primi a lamentarsi dello
spopolamento, ma poi non votano questa legge. Tanti sindaci sono lì
che si lamentano del fatto che abbiano i centri deserti e poi
votano contro alla moratoria che bloccherebbe la nascita di nuovi
esercizi commerciali, quindi coerenza zero da parte di tanti
sindaci.
Onore però a coloro che invece con orgoglio - perché mi è stato
riferito che qualcuno non si è appiattito, come fanno tanti - a un
parere del CPEL proposto da alcuni Sindaci, in maniera proprio
forte, si sono espressi contro quel parere di astensione del CPEL,
dicendo che questa legge poteva essere uno strumento per combattere
il fenomeno dello spopolamento.
Onore a questi sindaci che veramente hanno un coraggio, perché
sappiamo benissimo tutti che non allinearsi in certi ambienti,
quando ci sono certe proposte, non è per niente semplice.
Questa era una proposta di legge complessa, che tocca uno degli
aspetti dello spopolamento della montagna, che ho definito un
puzzle; questa è un pezzo del puzzle, e tutti hanno detto che è
fatta da misure anche interessanti.
Allora mi dico: ma perché appunto non provarlo? Perché o dite
una bugia, dicendo che sono misure interessanti e non le ritenete
tali, o vi riempite la bocca di parole e poi, nel pratico, quando
c'è qualcosa di diverso, di parallelo al discorso dei servizi e
quant'altro, non fate niente.
Il dubbio è che se questa proposta fosse stata fatta da parte di
un Consigliere di maggioranza, probabilmente tutti questi dubbi,
tutte queste dietrologie, tutti questi ""Eh, però serve una
valutazione generale"", questi ragionamenti non sarebbero stati
fatti. Questo è un dubbio, per carità, so benissimo che non
funziona così.
Ho terminato, mi terrò per la dichiarazione di voto."
47990,XVI,"ENTI LOCALI, Comuni",it,Aggravi,Stefano,1985,M,N/A,15,"Ci sono altri interventi in discussione
generale? Se non vi sono altri interventi nella discussione, chiudo
la discussione generale. La discussione generale è chiusa. Per il
Governo, replica l'assessore Caveri."
47990,XVI,"ENTI LOCALI, Comuni",it,Caveri,Luciano Emilio,1958,M,N/A,16,"Interverrà anche il Presidente, io mi
limiterò a qualche osservazione, partendo naturalmente da quello
che è già stato detto, cioè le difficoltà, quel che capita lo
sappiamo tutti, ma per fortuna non siamo all'anno zero, perché,
grazie all'autonomia, il nostro territorio, pur con tutti i limiti,
resta abitato, resta vivo, soprattutto - come è già stato fatto -
se lo compariamo solo con le vicine vallate piemontesi: anche dal
punto di vista politico e amministrativo, come ben sappiamo,
dipendono addirittura dall'area metropolitana di Torino e, se noi
non avessimo avuto l'autonomia, è assai probabile che oggi ci
troveremmo nella medesima e identica situazione.
Il tema che è stato sollevato è interessante ed è interessante
anche la proposta, che però ha tutta una serie di fragilità, allora
il ragionamento del consigliere Lavy è: ""Meglio qualcosina che
niente"".
Io credo invece che, nel momento in cui si deve decidere una
linea, bisogna farlo in maniera completa, e cercherò a questo
proposito, in pochi minuti, di fare qualche ragionamento.
Io sono reduce da un incontro sulla macroregione alpina in
Slovenia: è un'assise che sicuramente deve essere rafforzata, ha
delle debolezze, è nata ufficialmente all'inizio degli anni '10 e
mi sono permesso di segnalare all'attenzione dei colleghi nel
chiedere un maggiore impegno politico e meno visione tecnocratica
all'interno della macroregione alpina, perché credo che i temi che
oggi noi dobbiamo affrontare sono quattro più uno: il primo è il
cambiamento climatico, che modificherà in profondità il nostro
territorio; il secondo argomento è la transizione energetica, viste
anche le ambiziose prospettive che lo stesso Consiglio Valle si è
dato; la rivoluzione digitale, qualcuno ha citato il fatto che il
ripopolamento passa anche attraverso tecniche come il coworking, e,
ancora, la crisi demografica che, in Valle d'Aosta, in realtà si
aggiunge allo spopolamento, cioè la scelta che molti Valdostani,
fin dal dopoguerra, hanno fatto di scendere, chi nei comuni più
grandi del Fondovalle, chi invece nella città di Aosta che poi nel
frattempo si è spalmata in quella che noi chiamiamo la Plaine.
Si aggiunge un altro argomento che è centrale nel ritenere che
la Valle d'Aosta sia tutta montagna, il che naturalmente non vuol
dire che poi ci possono essere al nostro interno delle
classificazioni per zona; a me non convince l'altimetria, perché
qualcuno ha ricordato che oggi - come diceva Bernard Janin, il
celebre geografo - quelli che sono più in crisi sono quelli della
media montagna, se noi usiamo l'altimetria, andremo in qualche
maniera anche ad agevolare delle località turistiche dove il
benessere è del tutto evidente.
I sovraccosti colpiscono, è importante quello che sta facendo
l'Università della Valle d'Aosta, riprendendo un tema di alcuni
anni fa: capire che cosa significa l'impatto della scuola, dei
trasporti, della sanità; tutte spese che pesano moltissimo sul
nostro bilancio regionale e che dimostrano la particolarità delle
zone in montagna che dovrà essere rimarcata, specie quando
arriveranno accanto, o forse non più accanto, all'autonomia
differenziata, i famosi LEP.
Altro scenario: c'è uno scenario europeo che noi dobbiamo
seguire, perché abbiamo gli stessi problemi: lo stesso presidente
Kompatscher, in un dialogo anche assieme al presidente Testolin, ci
ha ricordato come loro abbiano una demografia elevata ma che è
scesa al di sotto di quella percentuale del tasso di fertilità che
garantisce una sostituzione alla popolazione. Noi siamo tombali da
questo punto di vista.
Lo studio del professor Rosina dell'Università Cattolica di
Milano ha dimostrato che nel 2034 noi avremo 10 mila Valdostani in
meno nell'età intermedia, cioè quella più produttiva.
Aggiungerei, perché è molto importante, che l'eventuale legge
regionale, che in qualche maniera regolamenti meglio la
particolarità di territori più elevati rispetto alla media, deve
tener conto della legge sulla montagna che, con i suoi 28 articoli,
è stata approvata dal Senato, non perché noi si debba ricopiare -
io sono sempre per una legislazione originale - ma perché questa
legge consente da una parte di avere tutta una serie di
particolarità che si potranno dimostrare nella legislazione delle
Regioni e delle Province autonome e, dall'altra, ci sono interventi
in materia che non sono nostra competenza. Credo che sarebbe
interessante immaginare di riaprire una discussione nel momento in
cui ci troveremo di fronte a un testo completo che, tra l'altro, va
a toccare uno dei nodi principali per la montagna italiana che è
quello della perimetrazione delle zone montane, perché, se c'è
troppa montagna (come oggi capita nelle antiche perimetrazioni,
addirittura degli anni '50) è molto difficile immaginare degli
interventi specifici, che valgono anche - lo ricordo in conclusione
- per l'Unione europea.
Con il nuovo Presidente di Auvergne-Rhône-Alpes, proprio in
Slovenia, abbiamo immaginato un patto della montagna europea,
cominciando dalla montagna alpina, perché è chiarissimo che oggi
nell'articolo 174 dei trattati si parla delle zone di montagna, ma
è rimasta sospesa quella necessaria direttiva che dovrebbe dire
qual è la montagna, che poi è diversa nel Massif Central piuttosto
che sui Pirenei, piuttosto che sull'Appennino, però ci vuole una
regolamentazione tenendo conto che molte delle materie che noi
abbiamo all'articolo 2 del nostro Statuto di autonomia - penso
all'agricoltura - sono in fondo legate oramai a decisioni che
vengono assunte dalla politica europea.
È giusto quindi dare il riconoscimento dello sforzo
intellettuale, dello sforzo giuridico, per addivenire a qualche
cosa, però, con tutta franchezza, credo che il quadro sia più
complesso e si può dire che se questo era l'inizio di una
discussione è bene, ma non si può considerare una fase
conclusiva."
47990,XVI,"ENTI LOCALI, Comuni",it,Aggravi,Stefano,1985,M,N/A,17,"Il Presidente della Regione ne ha
facoltà."
47990,XVI,"ENTI LOCALI, Comuni",it,Testolin,Renzo,1968,M,N/A,18,"Credo che a valle dell'ultimo intervento
del collega Caveri poco rimanga da aggiungersi.
Faccio alcune considerazioni di ordine più strettamente legato
al tessuto sul quale voleva inserirsi quest'iniziativa normativa;
un tessuto normativo già abbastanza ampio, che abbiamo avuto modo
di condividere anche durante un'attività ispettiva (ricordata dal
collega Restano) che ha sottolineato come all'interno del percorso
evolutivo e di attenzione al territorio montano e alle difficoltà
di viverlo...perché una cosa è cercare dei presupposti e delle
indicazioni per sostenere - anche in via continuativa, ammesso che
sia la strada migliore - la popolazione che vive in montagna a
poterlo fare a dei costi più bassi, una cosa invece è rendere
fruibile in maniera adeguata e anche al passo con i tempi ...anche
per così dire ""infrastrutturata"" e anche prodiga di opportunità,
soprattutto lavorative e di mantenimento della propria famiglia in
montagna con i servizi adeguati; sono due concetti un po' diversi e
l'aspetto principale è quello di andare ad osservare come tutta una
serie d'iniziative che avevamo già condiviso in quella sede hanno
cercato nel tempo di potenziare le caratteristiche della nostra
montagna, con la sicurezza sulla viabilità e con
l'infrastrutturazione, partita ormai negli anni '90, di quella
dorsale che avrebbe dovuto portare la fibra ottica - e l'ha
portata, fino ai nostri villaggi più alti.
Ancora ieri, in un'interessante riunione sviluppata nell'ambito
dell'Assessorato del collega Caveri, con Infratel si sono tracciate
delle opportunità che possono effettivamente creare delle nuove
potenzialità per chi vuole trasferirsi in montagna.
Questo è un lavoro che quotidianamente si affianca a delle leggi
specifiche per cercare di valorizzare le offerte anche lavorative
del nostro territorio.
L'ha citato il collega Jordan, riprendendo anche una traccia che
avevamo appunto già presentato alcune settimane fa: dal sostegno
alle stazioni sciistiche alle scuole di montagna, le agevolazioni
sui trasporti, un'attenzione particolare anche al dimensionamento e
alla percorribilità degli stessi, le iniziative sugli esercizi di
vicinato - per parlare di situazioni che vengono sviluppate
all'interno del Consiglio regionale - ma, ancora, in ambito più
ampio, tra le opportunità che possono mettersi a disposizione della
montagna, vi sono le risorse europee che, in primis, attraverso il
piano di sviluppo rurale e le attività legate al mondo agricolo,
hanno cercato di valorizzare tutta una serie di attività storiche e
tradizionali che mantenessero sul nostro territorio delle
opportunità di insediamento anche nei piccoli comuni e soprattutto
nei piccoli comuni dove giustamente un'azienda, una, due, cinque
persone, una famiglia fanno la differenza, a dispetto di quello che
magari può succedere nel fondovalle.
Una situazione che peraltro è molto articolata anche a livello
nazionale, mi ricordo che negli anni 2015-2016, quando ci furono le
prime attività di sostegno delle zone marginali, paradossalmente si
verificò il caso dove, ad esempio, Cogne, che è una stazione
turistica di primaria importanza per la nostra regione, era
ricompresa nelle zone marginali quando - adesso non vorrei
sbagliarmi - Avise o Saint-Nicolas, che aveva delle caratteristiche
altimetriche leggermente diverse e non un calo di popolazione così
importante percentualmente come quello di Cogne, non era
ricompresa.
Due paradossi che, se andiamo a vedere le due località, ti danno
una sensazione di montagna che non è proprio la stessa.
Questo per addivenire al fatto che c'è una rete, una serie
d'iniziative e di attività che continuano a essere sviluppate, come
gli investimenti che vengono perorati sul nostro territorio anche a
livello d'impianti di risalita, ma anche tutte quelle attività che
cercano di portare sicurezza anche per chi vive in montagna:
l'abbiamo già citato un paio di volte, ma non mi stancherò mai di
dirlo: l'elisoccorso piuttosto che le valorizzazioni di quelle
attività sci-alpinistiche legate al mondo delle randonnée, che
possono e devono portare anche gente giovane - proprio come diceva
lei - sul nostro territorio.
A questo bisogna affiancare - giustamente l'ha detto chi mi ha
preceduto - delle indicazioni più strutturate, più strutturali, che
passano da un lato sicuramente dalla legge della montagna, che è
stata messa in discussione, che dà una linea guida sulla quale si
potrà poi innestare un meccanismo regionale di approfondimento e di
adattamento anche alle caratteristiche e alle peculiarità del
nostro territorio; dall'altra parte una legge sulla zona franca che
ha come obiettivo non tanto stabilizzare nel tempo e negli anni,
nei decenni, un sostegno e un contributo, ma creare le condizioni
per rilanciare soprattutto un'attività nelle nostre zone marginali,
che sia conclamata e che sia garantita, alla quale poi dovrà
probabilmente contribuire, in maniera importante, la Regione con le
sue risorse, perché diciamo che la sensazione è piuttosto quella
che bisogna sdoganare il principio di poter identificare in maniera
autonoma, o comunque concordata, le zone sulle quali vogliamo
andare a intervenire, perché evidentemente - lei me lo insegna -
Courmayeur piuttosto che Valtournenche magari hanno meno bisogno di
Rhêmes-Saint-Georges, piuttosto che di Lillianes, Gaby o
Champorcher, di iniziative che possano essere sviluppate sul loro
territorio con un aiuto importante, limitato magari nel tempo ma
che possa permettere di attivare in questi territori delle
iniziative che possano poi dare gambe a un circolo virtuoso che
possa riportare interesse sul nostro territorio.
Questo è quello che ci eravamo un po' già detti in Commissione,
al netto di altri tecnicismi relativi a quella che è la copertura,
non la copertura.
Rimane comunque, non per perbenismo, il fatto di riconoscere
all'iniziativa una sua condivisione trasversale, che è stata penso
dimostrata anche dai colleghi intervenuti; ho apprezzato anche il
fatto che abbia sottolineato il voto negativo che ha permesso
comunque di portare in aula e di discutere questa proposta di legge
e credo che l'interesse sia trasversale, così come è stato
sottolineato, e che ci sarà ancora tempo e modo di lavorare con
attenzione soprattutto su quei due elementi che possono fare
veramente la differenza in questo contesto."
47990,XVI,"ENTI LOCALI, Comuni",it,Aggravi,Stefano,1985,M,N/A,19,"Consigliere Ganis, per dichiarazione di
voto, ne ha facoltà."
